{
  "mode": "code-review",
  "files_reviewed": [
    "backend/app/services/auth.py",
    "backend/app/api/routes/auth.py"
  ],
  "providers_used": ["openai", "anthropic", "gemini"],
  "failed_providers": [],
  "consensus_issues": [
    {
      "severity": "high",
      "location": "backend/app/services/auth.py:23",
      "category": "correctness",
      "description": "SHA-256 is not suitable for password hashing. It is too fast and lacks salting, making it vulnerable to brute-force and rainbow table attacks. Project rules require bcrypt.",
      "suggestion": "Replace hashlib.sha256 with bcrypt.checkpw/bcrypt.hashpw."
    }
  ],
  "majority_issues": [
    {
      "severity": "medium",
      "location": "backend/app/api/routes/auth.py:11",
      "category": "correctness",
      "description": "auth_service is referenced but never defined or imported in the routes module. This will cause a NameError at runtime.",
      "suggestion": "Inject AuthService via Flask's application context or a factory pattern.",
      "provider_count": 3
    }
  ],
  "individual_issues": {
    "openai": [
      {
        "severity": "low",
        "location": "backend/app/services/auth.py:34",
        "category": "maintainability",
        "description": "get_current_user returns None for invalid tokens, inconsistent with the exception-raising pattern in login.",
        "suggestion": "Raise AuthError for invalid tokens or document the None-return contract."
      }
    ],
    "anthropic": [
      {
        "severity": "medium",
        "location": "backend/app/services/auth.py:27",
        "category": "architecture",
        "description": "Session token is stored as plain text in the database.",
        "suggestion": "Store a hash of the token and compare hashes on lookup."
      }
    ],
    "gemini": [
      {
        "severity": "low",
        "location": "backend/app/api/routes/auth.py:22",
        "category": "craftsmanship",
        "description": "The /me endpoint lacks a docstring, violating project rules.",
        "suggestion": "Add a Google-style docstring."
      }
    ]
  },
  "quality_ratings": {
    "openai": "fair",
    "anthropic": "fair",
    "gemini": "fair"
  },
  "summary": {
    "total_issues": 5,
    "consensus_count": 1,
    "majority_count": 1,
    "synthesis": "All three providers identified the SHA-256 password hashing as a critical security flaw and the undefined auth_service as a runtime bug. Individual observations covered token storage, return value consistency, and missing docstrings."
  }
}
