{
  "mode": "design-question",
  "providers_used": ["openai", "anthropic"],
  "failed_providers": [],
  "consensus_recommendation": "Use CRUD (not event sourcing) as the foundation. Both providers agree event sourcing is over-engineered for the current scale and team experience.",
  "approaches": [
    {
      "name": "CRUD with audit log",
      "recommended_by": 1,
      "pros": [
        "Familiar to the team — Django ORM is purpose-built for CRUD",
        "Simple to implement and maintain",
        "PostgreSQL triggers or Django signals can capture changes for audit",
        "Low learning curve, fast time to market"
      ],
      "cons": [
        "Audit log is a bolt-on, not native to the data model",
        "Harder to replay history or reconstruct past states",
        "May need refactoring if event-driven features grow significantly"
      ],
      "risk_level": "low"
    },
    {
      "name": "CRUD with domain events",
      "recommended_by": 1,
      "pros": [
        "Keeps the familiar Django CRUD model the team knows",
        "Domain events provide an event stream for the recommendation engine",
        "Audit trail via a changes table with before/after snapshots",
        "Incremental path toward event sourcing if needed"
      ],
      "cons": [
        "Dual-write concern: must ensure both CRUD update and event publish succeed",
        "Audit trail is still a secondary concern",
        "Domain events need schema versioning as the system evolves"
      ],
      "risk_level": "low"
    },
    {
      "name": "Event sourcing",
      "recommended_by": 0,
      "pros": [
        "Complete audit trail is inherent",
        "Natural fit for temporal queries and recommendation engine",
        "Enables state reconstruction"
      ],
      "cons": [
        "Steep learning curve for the team",
        "Django and PostgreSQL are not natural ES tools",
        "Significantly more complex than needed at 1000 orders/day",
        "Requires new infrastructure (event store, projections, CQRS)"
      ],
      "risk_level": "high"
    }
  ],
  "summary": {
    "synthesis": "Both providers strongly recommend a CRUD-based approach over event sourcing, citing the team's Django expertise and the modest order volume. They differ on whether to add domain events now (Anthropic) or keep it simpler with just an audit log (OpenAI). The domain events approach offers a clearer path to the future recommendation engine but adds dual-write complexity."
  }
}
